{"actions":["Read-only inspection of `tools/skills/sample/`.","Ran the trusted bundled `quick_validate.py` with Python bytecode writes disabled."],"findings":["Bundled validation passed: `Skill is valid!`","`SKILL.md` has valid YAML frontmatter with the required `name` and `description`.","The folder name `sample` matches the frontmatter name.","The body is concise, imperative, and consistent with the stated behavior, including the no-modification constraint.","No extraneous files or directories are present.","Advisory: `sample` is generic and not a descriptive, verb-led skill name, which may reduce discoverability.","Advisory: recommended `agents/openai.yaml` UI metadata is absent."],"limitations":["The bundled validator checks only basic frontmatter format, allowed keys, and naming syntax; it does not assess trigger quality or task effectiveness.","No forward-testing was performed because this was validation-only and sub-agent work was not requested.","No files were created, modified, deleted, moved, formatted, initialized, or regenerated."],"route_decision":"Valid with non-blocking quality advisories.","target_resolution":"tools/skills/sample/","would_mutate":false}